[{"actor_id":"policy:replay-adapter@1","authority":"observation-only","causal_parents":[],"episode_id":"replay:native-replay:0:native-receipts","episode_root":{"digest":"sha256:fda45699709a10d54ca84247eef063a2ac3aca20b4c911476a1e0c682d3c0eb0","id":"replay:native-replay:0:native-receipts"},"event_id":"replay:native-replay:0:native-receipts/event:1","evidence_refs":["sha256:dc5d80dc3581cac6f6ff09115015d9fb2e2cd992bf2984cce798acc42dc15d09"],"mode":"replay","producer_revision":"sha256:3e8641ed04600a9317b74b9df7be5888348940bb636a4f1a56c7ae0efdd5ddc3","schema":"collective.event.v1","status":"observed","subject":{"revision":"mw-evidence@2026-10-15","uri":"mw:native-replay/gate"}},{"actor_id":"policy:replay-adapter@1","authority":"observation-only","causal_parents":["replay:native-replay:0:native-receipts/event:1"],"episode_id":"replay:native-replay:0:native-receipts","episode_root":{"digest":"sha256:fda45699709a10d54ca84247eef063a2ac3aca20b4c911476a1e0c682d3c0eb0","id":"replay:native-replay:0:native-receipts"},"event_id":"replay:native-replay:0:native-receipts/event:2","evidence_refs":["sha256:dc5d80dc3581cac6f6ff09115015d9fb2e2cd992bf2984cce798acc42dc15d09"],"mode":"replay","producer_revision":"sha256:3e8641ed04600a9317b74b9df7be5888348940bb636a4f1a56c7ae0efdd5ddc3","schema":"collective.event.v1","status":"observed","subject":{"revision":"mw-evidence@2026-10-15","uri":"mw:native-replay/gate"}},{"actor_id":"policy:replay-adapter@1","authority":"observation-only","causal_parents":[],"episode_id":"replay:native-replay:0:native-receipts","episode_root":{"digest":"sha256:fda45699709a10d54ca84247eef063a2ac3aca20b4c911476a1e0c682d3c0eb0","id":"replay:native-replay:0:native-receipts"},"event_id":"replay:native-replay:0:native-receipts/event:3","evidence_refs":["sha256:dc5d80dc3581cac6f6ff09115015d9fb2e2cd992bf2984cce798acc42dc15d09"],"mode":"replay","producer_revision":"sha256:3e8641ed04600a9317b74b9df7be5888348940bb636a4f1a56c7ae0efdd5ddc3","schema":"collective.event.v1","status":"observed","subject":{"revision":"mw-evidence@2026-10-15","uri":"mw:native-replay/run"}}]
